Nestle sells off Drumsticks, Edy's Häagen-Dazs in mega ice cream deal
Nestlé cannot claim bottled water is ‘essential public service’, court rules
Nestle to face lawsuit saying Poland Spring water not from a spring: U.S. judge
Nestle dairy supplier accused of animal abuse; cows being punched, kicked, stomped on
Nestle has been bottling and selling water it has no right to in drought-stricken California, state says
Nestle to invest almost $250 million in Brazil over the next three years
Group challenges Nestle's water permit from Michigan
Michigan approves Nestle's water withdrawal permit
Forest Service grants water bottler Nestle new permit to take water from public land in CA
Nestlé plan to take 1.1m gallons of water a day from natural springs sparks outcry
Nestle pays Starbucks $7.1bn to sell its coffee
Nestle continues to extract water from town despite severe drought: activists
The U.S. Supreme Court rejects a bid by Nestle to throw out a lawsuit seeking to hold them liable for the use of child slaves to harvest cocoa.
Nestle CEO Tim Brown on whether he'd consider stopping bottling water in California: "Absolutely not. In fact, I'd increase it if I could."
Investigation reveals Nestle extracts water from National Forest using expired permit, while cabin owners required to stop drawing water from a creek
Nestle Continues Stealing World's Water During Drought : Indybay
Nestle (water) lawyers playing hardball over township permit denial
Nestle Outbids Small Ontario Town to Purchase Water Source
Why Nestle pays next to nothing for Michigan groundwater
Nestle bottled water operations spark protests amid California drought: Petition carrying 500,000 signatures delivered to Sacramento and Los Angeles water bottling facilities
Planning commission rejects Nestle permit for pump station
Astronomers discover the first interstellar immigrant nestled in Jupiter’s orbit
Nestle Has Illegally Pumped Calif. Water Since the Last Major Drought—and Doesn't Want to Stop
Michigan residents deplore plan to let Nestle pump water for next to nothing | US news
Nestlé has failed to remove vanillan from baby formula as it promised
The maker of Oreos, Mondelez, sponsored the Guardian article about Nestle's child slavery accusations in Thailand.
Baltimore votes to become first large U.S. city to ban water privatization
US Forest Service investigates long expired permit Nestle uses to draw water out of California for bottled water
Nestle sells U.S. candy to Ferrero amid health push
After at least 7 children diagnosed with cancer, parents eye chemical in city's water
New permit for Nestle water-taking at low rate 'inappropriate': Wynne
U.S. Forest Service sued over expired Nestle water permit
US Forest Service investigates expired Nestle water permit
Nestle to destroy noodles worth $50m
Forest Service considers Nestle mountain water withdrawals
Nestle recalls millions of Stouffer's lasagnas, Lean Cuisines, and DiGiorno pizzas over pieces of glass found in food
Cassini spies shy moon nestled among Saturn's rings
Nestle accused of using slave-caught fish for cat food.
Outrage ensues as Michigan grants Nestlé permit to extract 200,000 gallons of water per day
"No more artificial flavors and colors in Butterfinger, Babe Ruth or any Nestle chocolate candies in the United States, because Americans want them gone, the Swiss food giant said Tuesday [17 February 2015]."
Nestlé launches 17$ KitKat's
Nestle voluntarily recalls Butterfinger Peanut Butter Crisps due to potential presence of plastics
Mysterious freshwater reservoir found hidden beneath the ocean
Nestle loses bid to trademark KitKat candy bar shape
Nestle Creates Sweeter-Tasting Sugar, So It Can Use Less
History of Arrowhead and how Nestle got to bottle California's limited water. 80 years, 5 facilities, 3 mergers and a defunded forest service.
The 'Wild West' of groundwater: Billion-dollar Nestle extracting Canada's drinking water for free, takes 265 million litres a year of fresh water
Fresh trouble for Nestle, fungus found in baby food Cerelac
Montreal: Canadian city's plan to ban plastic water bottles faces opposition from Coke, Pepsi and Nestle
A Look at the Russian Compounds Nestled in New York Suburb and Small Maryland Town
Nestlé Makes Billions Bottling Water It Pays Nearly Nothing For
Nestle says "forced labor has no place in our supply chain" following a U.S. class action lawsuit that alleges the Swiss food company knowingly supported a system of slave labor and human trafficking to make its Fancy Feast cat food
‘Not one drop’ of Poland Spring bottled water is from a spring, lawsuit claims
California regulators to Nestlé: Halt unauthorized water diversions
Nestle to cut hundreds of jobs in UK amid Poland move
Judge asked to force Gov. Snyder to resupply Flint with bottled water
‘If anyone can hear us … help.’ Puerto Rico’s mayors describe widespread devastation from Hurricane Maria
Nestle says it will destroy more than $50m worth of its hugely popular Maggi noodles
Nestle became the first major chocolate producer to partner with the Fair Labor Association. The FLA announced that it has mapped Nestlé’s cocoa supply chain and identified numerous labor violations, including cases of forced child labor. Nestlé has agreed to build a system to monitor for violations
State ends water distribution in Flint
Nestle to remove artificial flavours in US chocolate
Nestle's 'hollow' sugar could cut calories in chocolate
Huge Water Reserves Found All Over Mars
Delhi Bans Popular Noodles Produced by Nestle's India Unit
DanWatch report -Working conditions on coffee farms in the Nestle supply chain.
Nestle & Danoe under investigation for possibly price-fixing Baby Formula Milk
Nestle, the world's biggest food company, has removed beef pasta meals from shelves in Italy and France after tests revealed traces of horse DNA.

General Mills to buy natural pet food company Blue Buffalo for about $8 billion in cash
Harvard's Endowment Profits from California's Dwindling Water Supply
Nestle Pulls Kit Kat Mascot Because It Looks Like Pedobear
Nestle CEO Wants to Privatize public Water Supplies, Stating those who call it a Public Right have a very "Extreme" view
Oregon is a possible destination for the next Nestle bottling plant.
FDA tests Nestles Maggi noodles after food scare prompts recall in India
After being shamed into it by Greenpeace, Nestle adopts a 'zero deforestation' policy
Nestle Recalling 10,000 Haagen-Dazs Ice Cream for having wrong label
As California drought worsens critics take aim at Nestlé bottled water plant in Sacramento
Nestle investing heavily in "exercise in a bottle" product for American consumers
In numbers: How Nestle India will destroy 27 tonnes of Maggi noodles
ODFW agrees to new approach for Nestle bottled water plant in Cascade Locks(Xpost /r/Cascadia)
Cape Town is months away from running out of water. Residential running water will likely run out in April.
Nestlé Discovers Water in the Arizona Desert, and Bottles It
Michigan lawmaker wants to charge water bottlers per gallon
Kit Kat case: Apparently you can't "own" a shape
Nestle USA recalling 238,000 cases of Hot Pockets that may contain meat included in a massive recall of nearly 9 million lbs of “diseased and unsound” beef products
Guy slams nestle on Reddit, Gets mentioned on Huffington Post
Nestle finds horsemeat in beef pasta meals
Nestle Faces $5 Million Lawsuit Over Trans Fats in Frozen Pizzas
Conflict of interest claims persist in Maine’s Nestle water case
Feds Sued for Allowing Nestlé to Jack Water From SoCal National Forest
Nestlé bottled-water company seeks to take more Michigan water
Kit Kat 'Pedobear' Photo: Nestle Pulls Instagram Image Resembling Infamous Meme
Mexico protesters fear US-owned brewery will drain their land dry
Nestle removes beef pasta meals from shelves in Italy and Spain after tests reveal traces of horsemeat
Nestlé admits slavery in Thailand while fighting child labour lawsuit in Ivory Coast
Nestlé's California Water Permit Expired 27 Years Ago
Nestle's Pedobear mixup kills Kit Kat Instagram photo - latimes.com
Food Business News | Nestle to acquire Pfizer Nutrition
DiGiorno pizzas, Stouffer's meals recalled for glass in food
Android's latest software, Pie, launches today
Hot Pockets pulled from shelves for containing 'diseased and unsound animals'
